{
  "schema_version": "1.0",
  "skill": "project-planner",
  "status": "ready",
  "title": "Publish a tutoring enquiry page in two weeks",
  "summary": "Use two three-hour work blocks to write, build, test, and publish one page with an enquiry form.",
  "assumptions": ["You already have a site builder account and can publish without purchasing a new service.", "Effort estimates are rough and should be adjusted after the first work session.", "Weeks are relative planning blocks because no start date was provided."],
  "questions": [],
  "limitations": ["This is a proposed plan; no site, form, or calendar event has been created."],
  "data": {
    "goal": "Publish one page describing your maths tutoring and accepting enquiries.",
    "success_criteria": ["The page describes the students you help and the tutoring format.", "The enquiry form successfully delivers a test enquiry.", "The published page is readable on a phone."],
    "time_budget_hours_per_week": 3,
    "time_budget_minutes_total": null,
    "start_date": null,
    "deadline": null,
    "timezone": null,
    "milestones": [
      {"id": "m1", "title": "Page ready to test", "done_when": "A draft page contains the offer, practical details, and enquiry form.", "target_date": null},
      {"id": "m2", "title": "Page published", "done_when": "A test enquiry arrives and the mobile-checked page is published.", "target_date": null}
    ],
    "tasks": [
      {"id": "t1", "title": "Define the tutoring offer", "milestone_id": "m1", "depends_on": [], "estimated_minutes": 45, "status": "planned", "week": 1, "deliverable": "Five bullets covering student level, subjects, lesson format, availability, and enquiry method."},
      {"id": "t2", "title": "Write the page copy", "milestone_id": "m1", "depends_on": ["t1"], "estimated_minutes": 45, "status": "planned", "week": 1, "deliverable": "A headline, short introduction, practical details, and enquiry invitation."},
      {"id": "t3", "title": "Build the draft page", "milestone_id": "m1", "depends_on": ["t2"], "estimated_minutes": 90, "status": "planned", "week": 1, "deliverable": "One draft page in the existing site builder with an enquiry form."},
      {"id": "t4", "title": "Test the enquiry form", "milestone_id": "m2", "depends_on": ["t3"], "estimated_minutes": 60, "status": "planned", "week": 2, "deliverable": "A received test enquiry and corrected form errors."},
      {"id": "t5", "title": "Check the mobile layout and copy", "milestone_id": "m2", "depends_on": ["t3"], "estimated_minutes": 60, "status": "planned", "week": 2, "deliverable": "A readable phone layout with checked contact details and working links."},
      {"id": "t6", "title": "Publish and verify the live page", "milestone_id": "m2", "depends_on": ["t4", "t5"], "estimated_minutes": 60, "status": "planned", "week": 2, "deliverable": "A live URL and a successful enquiry submitted through the published page."}
    ],
    "first_action": "Write the five bullets in t1 before opening the site builder.",
    "deferred": ["Paid advertising, a custom booking system, and additional pages are outside this launch scope."]
  }
}
